{
  "artifacts": [
    {
      "path": "artifacts/proof/grantsgov-PerformanceSite.jsonl.manifest.json",
      "role": "xsd_manifest",
      "sha256": "3fc4549ba234a64bc936d26f1d06c65c43f66efa4b88d054bc51e68330d1d19c"
    },
    {
      "path": "artifacts/proof/grantsgov-PerformanceSite.jsonl",
      "role": "xsd_records",
      "sha256": "41d45b4e0282e14045c6090051a65811b83425e2a7fdad8f3a0773e1f9ea6b8d"
    },
    {
      "path": "harness/contracts/expansion-a/evidence/PerformanceSite-behaviors.jsonl",
      "role": "behavior_records",
      "sha256": "0dcc163568b670962a749fd0da01c56eb47d9a51727c2d5bbf8096a224ff8181"
    },
    {
      "path": "artifacts/authoring/form-authoring-contract-v2/forms/PerformanceSite.json",
      "role": "authoring_contract",
      "sha256": "fbdc47bfc4a90800a60ab6fac6ccecc67da1769849b9f683ad880c9a4a66f278"
    },
    {
      "path": "artifacts/authoring/project-people-family/forms/PerformanceSite.json",
      "role": "component_proposals",
      "sha256": "ddab4af00e9ff190dceaf7e67d9ede4a5fc38624bb0317a67b1ba153aa15aa5c"
    },
    {
      "path": "artifacts/authoring/runtime-rule-ast-resolved-v1/forms/PerformanceSite.json",
      "role": "runtime_rules",
      "sha256": "8503d03fac54fac3173f93363d177162ce2c50143abac374a7fe2e1f38e194de"
    }
  ],
  "behaviorEvidence": [
    {
      "id": "behavior:sha256:b310b74b5938a38a516d4db3ddac288810d769720ecf7676872e73e85f239473",
      "inputRole": "presentation",
      "reviewStatus": "unreviewed",
      "sourceRecord": {
        "allowed_values": [],
        "behavior_key": "behavior:sha256:b310b74b5938a38a516d4db3ddac288810d769720ecf7676872e73e85f239473",
        "business_rules": "Clicking displays burden statement: SF-424 PROJECT/PERFORMANCE SITE LOCATION(S) FORM (4040-0010) According to the Paperwork Reduction Act of 1995, an agency may not conduct or sponsor, and a person is not required to respond to a collection of information unless it displays a valid OMB control number. The valid OMB control number for this information collection is 4040-0010. The time required to complete this information collection is estimated to average 14 minutes per response, including the time to review instructions, search existing data resources, gather the data needed and complete and review the information collection. If you have comments concerning the accuracy of the time estimate(s) or suggestions for improving this form, please write to: U.S. Department of Health & Human Services, OS/OCIO/PRA, 200 Independence Ave., S.W., Suite 537-H, Washington D.C. 20201, Attention: PRA Reports Clearance Officer. Agency Total Average Burden Total Burden Responses per response in Hours Hours NSF 34000 10/60 5667 VA 750 20/60 250 USAID 300 5/60 25 IMLS 420 5/60 35 DOD 12210 4/60 814 HHS 122339 11/60 22429 DOI 76132 19/60 24108 SSA 2000 2/60 67 NEA 5 345 5/60 445 DOJ 3 4471 15/60 8618 USDA 7150 10/60 1192 EPA 15264 5/60 1272 HUD 9100 30/60 4550 NASA 9435 15/60 2359 NARA 150 10/60 25 NEH 3750 15/60 938 DOT 3400 53/60 3003 ED 14191 10/60 2365 DOE 7150 20/60 2383 DHS 23 30/60 12 Total 357580 80557 80557 total hrs. x 60 minutes = 4833420 total minutes. 4833420 / 357580 total responses = 14 minutes per response.",
        "condition": "Clicking displays burden statement: SF-424 PROJECT/PERFORMANCE SITE LOCATION(S) FORM (4040-0010) According to the Paperwork Reduction Act of 1995, an agency may not conduct or sponsor, and a person is not required to respond to a collection of information unless it displays a valid OMB control number. The valid OMB control number for this information collection is 4040-0010. The time required to complete this information collection is estimated to average 14 minutes per response, including the time to review instructions, search existing data resources, gather the data needed and complete and review the information collection. If you have comments concerning the accuracy of the time estimate(s) or suggestions for improving this form, please write to: U.S. Department of Health & Human Services, OS/OCIO/PRA, 200 Independence Ave., S.W., Suite 537-H, Washington D.C. 20201, Attention: PRA Reports Clearance Officer. Agency Total Average Burden Total Burden Responses per response in Hours Hours NSF 34000 10/60 5667 VA 750 20/60 250 USAID 300 5/60 25 IMLS 420 5/60 35 DOD 12210 4/60 814 HHS 122339 11/60 22429 DOI 76132 19/60 24108 SSA 2000 2/60 67 NEA 5 345 5/60 445 DOJ 3 4471 15/60 8618 USDA 7150 10/60 1192 EPA 15264 5/60 1272 HUD 9100 30/60 4550 NASA 9435 15/60 2359 NARA 150 10/60 25 NEH 3750 15/60 938 DOT 3400 53/60 3003 ED 14191 10/60 2365 DOE 7150 20/60 2383 DHS 23 30/60 12 Total 357580 80557 80557 total hrs. x 60 minutes = 4833420 total minutes. 4833420 / 357580 total responses = 14 minutes per response.",
        "data_type": "",
        "fid": "723",
        "field_id": "Burden Statement Button",
        "field_number": "0-0",
        "form_id": "PerformanceSite",
        "form_version": "4.0",
        "implementation": "Button",
        "input_role": "presentation",
        "label": "View Burden Statement",
        "max_occurs": null,
        "maximum": null,
        "min_occurs": null,
        "minimum": null,
        "provenance": [
          "sha256:c0747c333fb89f0be2403e1b4b2beb6ab971391fd85c6aa0cf0a678519e26615 https://apply07.grants.gov/apply/forms/sample/PerformanceSite_4_0-V4.0_F723.xls"
        ],
        "required": null,
        "source": "grants.gov.dat",
        "source_ref": "https://apply07.grants.gov/apply/forms/sample/PerformanceSite_4_0-V4.0_F723.xls",
        "source_version": "sha256:c0747c333fb89f0be2403e1b4b2beb6ab971391fd85c6aa0cf0a678519e26615"
      }
    },
    {
      "id": "behavior:sha256:b0017fe761c0d98a43c1215d7c5095b140e7f557a7512952f3281dd4a9d847a6",
      "inputRole": "presentation",
      "reviewStatus": "unreviewed",
      "sourceRecord": {
        "allowed_values": [],
        "behavior_key": "behavior:sha256:b0017fe761c0d98a43c1215d7c5095b140e7f557a7512952f3281dd4a9d847a6",
        "business_rules": "",
        "condition": "",
        "data_type": "",
        "fid": "723",
        "field_id": "OMB Number Text",
        "field_number": "0-1",
        "form_id": "PerformanceSite",
        "form_version": "4.0",
        "implementation": "Label",
        "input_role": "presentation",
        "label": "OMB Number: 4040-0010",
        "max_occurs": null,
        "maximum": null,
        "min_occurs": null,
        "minimum": null,
        "provenance": [
          "sha256:c0747c333fb89f0be2403e1b4b2beb6ab971391fd85c6aa0cf0a678519e26615 https://apply07.grants.gov/apply/forms/sample/PerformanceSite_4_0-V4.0_F723.xls"
        ],
        "required": null,
        "source": "grants.gov.dat",
        "source_ref": "https://apply07.grants.gov/apply/forms/sample/PerformanceSite_4_0-V4.0_F723.xls",
        "source_version": "sha256:c0747c333fb89f0be2403e1b4b2beb6ab971391fd85c6aa0cf0a678519e26615"
      }
    },
    {
      "id": "behavior:sha256:f512faeaf451b5d484f2887a5b4522e6843d342415a085ff59b74dee7e3f0d32",
      "inputRole": "presentation",
      "reviewStatus": "unreviewed",
      "sourceRecord": {
        "allowed_values": [],
        "behavior_key": "behavior:sha256:f512faeaf451b5d484f2887a5b4522e6843d342415a085ff59b74dee7e3f0d32",
        "business_rules": "",
        "condition": "",
        "data_type": "",
        "fid": "723",
        "field_id": "Expiration Date Text",
        "field_number": "0-2",
        "form_id": "PerformanceSite",
        "form_version": "4.0",
        "implementation": "Label",
        "input_role": "presentation",
        "label": "Expiration Date: 12/31/2026",
        "max_occurs": null,
        "maximum": null,
        "min_occurs": null,
        "minimum": null,
        "provenance": [
          "sha256:c0747c333fb89f0be2403e1b4b2beb6ab971391fd85c6aa0cf0a678519e26615 https://apply07.grants.gov/apply/forms/sample/PerformanceSite_4_0-V4.0_F723.xls"
        ],
        "required": null,
        "source": "grants.gov.dat",
        "source_ref": "https://apply07.grants.gov/apply/forms/sample/PerformanceSite_4_0-V4.0_F723.xls",
        "source_version": "sha256:c0747c333fb89f0be2403e1b4b2beb6ab971391fd85c6aa0cf0a678519e26615"
      }
    },
    {
      "id": "behavior:sha256:576d555edbb5d645c392df3190620dfa8c59ff1f18b25f018bfad4e4092e8cb5",
      "inputRole": "presentation",
      "reviewStatus": "unreviewed",
      "sourceRecord": {
        "allowed_values": [],
        "behavior_key": "behavior:sha256:576d555edbb5d645c392df3190620dfa8c59ff1f18b25f018bfad4e4092e8cb5",
        "business_rules": "",
        "condition": "",
        "data_type": "",
        "fid": "723",
        "field_id": "Form Title Text",
        "field_number": "0-3",
        "form_id": "PerformanceSite",
        "form_version": "4.0",
        "implementation": "Label",
        "input_role": "presentation",
        "label": "Project/Performance Site Location(s)",
        "max_occurs": null,
        "maximum": null,
        "min_occurs": null,
        "minimum": null,
        "provenance": [
          "sha256:c0747c333fb89f0be2403e1b4b2beb6ab971391fd85c6aa0cf0a678519e26615 https://apply07.grants.gov/apply/forms/sample/PerformanceSite_4_0-V4.0_F723.xls"
        ],
        "required": null,
        "source": "grants.gov.dat",
        "source_ref": "https://apply07.grants.gov/apply/forms/sample/PerformanceSite_4_0-V4.0_F723.xls",
        "source_version": "sha256:c0747c333fb89f0be2403e1b4b2beb6ab971391fd85c6aa0cf0a678519e26615"
      }
    },
    {
      "id": "behavior:sha256:a7ce7c353a628f658731eff844538198815f13bcb03def98380674e4507275d1",
      "inputRole": "applicant_entered",
      "reviewStatus": "unreviewed",
      "sourceRecord": {
        "allowed_values": [],
        "behavior_key": "behavior:sha256:a7ce7c353a628f658731eff844538198815f13bcb03def98380674e4507275d1",
        "business_rules": "",
        "condition": "",
        "data_type": "Checkbox",
        "fid": "723",